{
  "$schema": "schema/project-status.schema.json",
  "schema_version": "1.0",
  "updated_at": "2026-09-13T21:05:42+08:00",
  "objective": "Build a version-pinned, coverage-measured, searchable and executable white-box account of JAX-to-TPU, including transformations, compiler passes, libtpu compiler/runtime, LLO and hardware mapping.",
  "plan_path": "PLAN.md",
  "baseline_path": "manifests/baseline.json",
  "current_phase": {
    "id": "P1",
    "title": "Runtime provenance and source-built jaxlib",
    "state": "running",
    "notes": [
      "P0 core is closed with machine-checked baseline, evidence, coverage, architecture and recovery-state contracts; L4/L5 claims remain fail-closed until their contracts and required TPU inputs exist.",
      "Tokamax and the private framework remain external inputs for early workload intake and feature census.",
      "An unwrapped exploratory CPU build was launched only to populate the Bazel cache; its live state and result are deliberately excluded from durable evidence."
    ]
  },
  "milestones": [
    {
      "id": "p0-core-foundation",
      "title": "Version-pinned plan, evidence and coverage contracts, public-boundary architecture, glossary and recovery state",
      "state": "complete",
      "completed_at": "2026-09-08T15:10:52+08:00",
      "artifacts": [
        "AGENTS.md",
        "HANDOFF.md",
        "PLAN.md",
        "README.md",
        "manifests/baseline.json",
        "manifests/coverage.json",
        "manifests/schema/baseline.schema.json",
        "manifests/schema/capture.schema.json",
        "manifests/schema/coverage.schema.json",
        "manifests/schema/native-binaries.schema.json",
        "manifests/schema/project-status.schema.json",
        "manifests/schema/source-index.schema.json",
        "manifests/schema/topic.schema.json",
        "manifests/status.json",
        "tools/capture-baseline.py",
        "tools/validate-evidence.py",
        "tools/selftest-validate-evidence.py",
        "tools/validate-coverage.py",
        "tools/selftest-validate-coverage.py",
        "tools/project-status.py",
        "tools/selftest-project-status.py",
        "docs/contributing/evidence-conventions.md",
        "docs/contributing/examples/03-jit-cache/topic.json",
        "docs/contributing/examples/03-jit-cache/source-index.json",
        "docs/contributing/examples/03-jit-cache/captures/jit-cold-call/manifest.json",
        "docs/architecture/00-whole-stack.md",
        "docs/architecture/01-regular-xla-tpu-path.md",
        "docs/architecture/02-pallas-mosaic-tpu-path.md",
        "docs/architecture/03-runtime-control-plane.md",
        "docs/index/glossary.md"
      ],
      "notes": [
        "Pinned-source cross-review covers the public JAX, StableHLO/Shardy, XLA and PJRT/libtpu ABI seams; it does not claim libtpu, LLO or hardware internals are covered.",
        "Semantic validators reject forged or spliced source, binary, capture, replay, coverage and recovery-state relationships through isolated negative fixtures.",
        "VERSION-SKEW is a provenance qualifier, not an evidence level; the current CPU jaxlib remains intentionally version-skewed."
      ]
    },
    {
      "id": "plan-background-motivation",
      "title": "Engineering background and motivation grounded in public cases with a restricted supporting archive",
      "state": "complete",
      "completed_at": "2026-09-08T17:45:22+08:00",
      "artifacts": [
        "PLAN.md",
        "docs/research/background-motivation-cases.md",
        "docs/research/background-motivation-sources.json"
      ],
      "notes": [
        "The documentation milestone adds fourteen public historical cases and clarifies the audience, cross-stack debugging, intervention points, upstream collaboration and validation needs.",
        "Restricted source material remains outside Git behind an opaque archive locator and manifest hash. Historical issue and PR reports do not establish baseline execution evidence or increase coverage depth.",
        "The P1 recovery queue is unchanged. Initial recovery checks encountered unavailable pinned source revisions; final project-status and evidence validation plus their selftests passed once the pinned source trees were available. No runtime experiment was performed for this milestone."
      ]
    },
    {
      "id": "environment-sync-foundation",
      "title": "Pinned core-source and uv synchronization with a verified Docker toolchain",
      "state": "complete",
      "completed_at": "2026-09-08T17:58:29+08:00",
      "artifacts": [
        "env/environment.lock.json",
        "env/Dockerfile",
        "env/verify-image.py",
        "env/install-packages.sh",
        "env/fetch-apt-package.sh",
        "tools/sync-environment.py",
        "tools/selftest-sync-environment.py",
        "docs/exec-plans/2026-09-08-environment-sync.md",
        "docs/building/source-built-jaxlib.md",
        "README.md",
        "HANDOFF.md"
      ],
      "notes": [
        "Five baseline source roots are initialized at their pinned commits; this is not the full eager-source or GPU archive materialization.",
        "Host CPU synchronization, baseline verification, historical evidence (1 topic, 1 capture, 34 file hashes), current Lab 001 assertions and project recovery checks passed.",
        "17 isolated synchronization contracts passed, including user-work preservation, interrupted checkout recovery, URL/path/hash checks and APT SHA-256 enforcement.",
        "The Docker image was built from the pinned base digest and Ubuntu snapshot; its tool fingerprints and strict jaxlib preflight passed. Host Python 3.12.3-1ubuntu0.16 and the host notebook venv remain intact; the isolated container uses the original 0.15 Python bytes.",
        "Historical capture reconstruction remains separate from recording-time live source matching; no original evidence or VERSION-SKEW qualifier was rewritten.",
        "Q005, the Bazel external dependency closure and the first official jaxlib build are still pending."
      ]
    },
    {
      "id": "plan-organization-engineering-cases",
      "title": "Recenter research motivation on organization contributor scenarios",
      "state": "complete",
      "completed_at": "2026-09-08T18:16:32+08:00",
      "artifacts": [
        "PLAN.md",
        "docs/research/organization-engineering-cases.md",
        "docs/research/organization-engineering-sources.json",
        "docs/research/background-motivation-cases.md"
      ],
      "notes": [
        "Replaced the background case table with contributor-origin cases after separately checking organization membership and repository visibility.",
        "The new public dossier contains sixteen scenario groups; private supporting records and the membership snapshot remain in the restricted archive. Issue/PR state, landing evidence and reported validation are distinct.",
        "P1 actions, pinned baselines and coverage depth are unchanged; this milestone adds historical research context and no runtime experiments.",
        "Passed contributor membership matching, complete author-query checks, archived snapshot hashes, metadata/link/publication checks, project-status and evidence validation, and both corresponding selftests."
      ]
    },
    {
      "id": "plan-engineering-outcomes",
      "title": "Define research background and motivation around engineering outcomes",
      "state": "complete",
      "completed_at": "2026-09-08T23:25:22+08:00",
      "artifacts": [
        "PLAN.md"
      ],
      "notes": [
        "Reframed the background around organization-origin cross-layer performance work and the path from symptoms to source changes and verified outcomes.",
        "Motivation now covers total delivery cost, choice of objective and intervention point, bounded and recoverable experimentation, and verifiable semantics and performance. Team learning and upstream collaboration remain explicit.",
        "AI is a consumer and execution collaborator of the JAX-to-TPU research artifacts. Benefits are evaluation targets, not measured productivity claims or assertions that AI cannot solve the historical cases.",
        "The organization case table, analysis boundary, pinned baselines, coverage, current phase and Q005 recovery queue are preserved. No runtime experiment or AI comparison was performed."
      ],
      "next_command": ".venv/bin/python -B tools/project-status.py"
    }
  ],
  "active_work": [
    {
      "id": "kickoff-documentation-validation",
      "title": "Complete recovery-state validation for the standalone kickoff documentation checkpoint",
      "state": "blocked",
      "artifacts": [
        "kickoff.md",
        "PLAN.md",
        "manifests/status.json",
        ".gitignore"
      ],
      "notes": [
        "The kickoff is self-contained: background, overall and first-phase goals, scope, terminology, pinned source revisions, research search space, methods, work packages, milestone exit criteria, evidence levels, coverage depths and open decisions are explained inline. Repository links, recovery commands and P/Q/I queue identifiers have been removed from its reading flow.",
        "Two user-designated internal kickoff documents were read through the official Outline MCP using authorized read-only OAuth. They inform document organization only; their project designs, performance values, private identities and schedules are not copied into Git. Codex MCP configuration and authentication are local user settings outside this repository.",
        "Restricted writing-reference archive: artifact:kickoff-reference-20260913; manifest SHA-256 23c38525d879a8d4da16a68990ff3ea5baa932d01ff2261648d95e08d0d90a61. Retrieval: request the authorized local archive from the project maintainer. This is a writing-reference snapshot, not baseline execution evidence.",